[
    {
        "id": 1,
        "title": "Activity 1",
        "dueDate": "2023-07-30T12:12:37.0780186+00:00",
        "completed": false
    },
    {
        "id": 2,
        "title": "Activity 2",
        "dueDate": "2023-07-30T13:12:37.0780207+00:00",
        "completed": true
    },
    {
        "id": 3,
        "title": "Activity 3",
        "dueDate": "2023-07-30T14:12:37.0780211+00:00",
        "completed": false
    },
    {
        "id": 4,
        "title": "Activity 4",
        "dueDate": "2023-07-30T15:12:37.0780214+00:00",
        "completed": true
    },
    {
        "id": 5,
        "title": "Activity 5",
        "dueDate": "2023-07-30T16:12:37.0780217+00:00",
        "completed": false
    },
    {
        "id": 6,
        "title": "Activity 6",
        "dueDate": "2023-07-30T17:12:37.0780221+00:00",
        "completed": true
    },
    {
        "id": 7,
        "title": "Activity 7",
        "dueDate": "2023-07-30T18:12:37.0780224+00:00",
        "completed": false
    },
    {
        "id": 8,
        "title": "Activity 8",
        "dueDate": "2023-07-30T19:12:37.0780227+00:00",
        "completed": true
    },
    {
        "id": 9,
        "title": "Activity 9",
        "dueDate": "2023-07-30T20:12:37.0780229+00:00",
        "completed": false
    },
    {
        "id": 10,
        "title": "Activity 10",
        "dueDate": "2023-07-30T21:12:37.0780234+00:00",
        "completed": true
    },
    {
        "id": 11,
        "title": "Activity 11",
        "dueDate": "2023-07-30T22:12:37.0780237+00:00",
        "completed": false
    },
    {
        "id": 12,
        "title": "Activity 12",
        "dueDate": "2023-07-30T23:12:37.078024+00:00",
        "completed": true
    },
    {
        "id": 13,
        "title": "Activity 13",
        "dueDate": "2023-07-31T00:12:37.0780243+00:00",
        "completed": false
    },
    {
        "id": 14,
        "title": "Activity 14",
        "dueDate": "2023-07-31T01:12:37.0780245+00:00",
        "completed": true
    },
    {
        "id": 15,
        "title": "Activity 15",
        "dueDate": "2023-07-31T02:12:37.0780248+00:00",
        "completed": false
    },
    {
        "id": 16,
        "title": "Activity 16",
        "dueDate": "2023-07-31T03:12:37.0780251+00:00",
        "completed": true
    },
    {
        "id": 17,
        "title": "Activity 17",
        "dueDate": "2023-07-31T04:12:37.0780254+00:00",
        "completed": false
    },
    {
        "id": 18,
        "title": "Activity 18",
        "dueDate": "2023-07-31T05:12:37.0780258+00:00",
        "completed": true
    },
    {
        "id": 19,
        "title": "Activity 19",
        "dueDate": "2023-07-31T06:12:37.0780261+00:00",
        "completed": false
    },
    {
        "id": 20,
        "title": "Activity 20",
        "dueDate": "2023-07-31T07:12:37.0780263+00:00",
        "completed": true
    },
    {
        "id": 21,
        "title": "Activity 21",
        "dueDate": "2023-07-31T08:12:37.0780266+00:00",
        "completed": false
    },
    {
        "id": 22,
        "title": "Activity 22",
        "dueDate": "2023-07-31T09:12:37.0780269+00:00",
        "completed": true
    },
    {
        "id": 23,
        "title": "Activity 23",
        "dueDate": "2023-07-31T10:12:37.0780272+00:00",
        "completed": false
    },
    {
        "id": 24,
        "title": "Activity 24",
        "dueDate": "2023-07-31T11:12:37.0780274+00:00",
        "completed": true
    },
    {
        "id": 25,
        "title": "Activity 25",
        "dueDate": "2023-07-31T12:12:37.0780277+00:00",
        "completed": false
    },
    {
        "id": 26,
        "title": "Activity 26",
        "dueDate": "2023-07-31T13:12:37.078028+00:00",
        "completed": true
    },
    {
        "id": 27,
        "title": "Activity 27",
        "dueDate": "2023-07-31T14:12:37.0780282+00:00",
        "completed": false
    },
    {
        "id": 28,
        "title": "Activity 28",
        "dueDate": "2023-07-31T15:12:37.0780285+00:00",
        "completed": true
    },
    {
        "id": 29,
        "title": "Activity 29",
        "dueDate": "2023-07-31T16:12:37.0780288+00:00",
        "completed": false
    },
    {
        "id": 30,
        "title": "Activity 30",
        "dueDate": "2023-07-31T17:12:37.0780291+00:00",
        "completed": true
    }
]